Respondent,Feedback,Suggestion,Date Submitted,Time Submitted,Feedback category
Gerardo Thompson,Quia vero est tempore. Explicabo praesentium consequatur voluptas maxime. Eveniet non sit error quis sequi beatae quas dignissimos quod.,Consequuntur nesciunt rem corrupti necessitatibus facilis nisi facilis sed.,2019-06-05T08:45:29.927Z,2088-12-31T18:03:07.577Z,positive
Nettie Adams,Repellendus quibusdam cupiditate nam sint voluptates amet animi qui voluptatibus. Ab rerum ut sequi id veritatis id sequi assumenda vel. Veniam natus vitae necessitatibus. Atque iure rerum voluptates quidem reiciendis. Aperiam ducimus perferendis optio ad odio eius minus.,Architecto doloremque voluptates fuga quam.,2020-11-11T06:26:39.620Z,2068-09-28T06:05:04.122Z,negative
Bethany Purdy MD,Autem eveniet deleniti. In molestias modi tenetur vel voluptate ab esse exercitationem. Deserunt eum a odio. Voluptatum adipisci similique quos ducimus neque distinctio maiores commodi. Culpa adipisci assumenda natus possimus quidem reiciendis nobis esse dolores. Deleniti culpa nostrum.,Illum cupiditate sint facere recusandae voluptas illum consequuntur asperiores.,2022-09-05T20:15:59.625Z,2028-10-25T11:10:17.748Z,neutral
Mitchell Pacocha,Vero nam repellat laboriosam voluptas iure quo maiores nam eos. Itaque sed soluta itaque voluptatum suscipit tempora. Numquam earum quo placeat. Id quibusdam incidunt.,Doloremque necessitatibus omnis consequuntur recusandae atque ex.,2015-04-09T20:08:16.162Z,2083-08-09T07:59:35.508Z,negative
Ramona Luettgen,Tenetur repudiandae aut. Ipsum qui suscipit voluptatibus atque quas ut commodi quam. Placeat dignissimos porro.,Magnam accusantium enim cumque rerum cum.,2014-03-14T08:45:37.792Z,2012-09-29T01:46:11.922Z,neutral
Dana Bradtke I,Reprehenderit ipsam numquam ipsam. Similique architecto rerum vero doloribus. Ea quia cupiditate reprehenderit distinctio voluptate officiis. Itaque quis temporibus hic quisquam eos aliquid.,Ipsam vitae nobis quod iure.,2013-05-25T03:45:05.168Z,2019-08-05T11:05:54.224Z,negative
Chelsea Schneider,Tempora veritatis hic dolores hic ut excepturi ducimus exercitationem. Commodi commodi et molestiae. Sit autem corrupti in harum odit provident. Quam dignissimos cum dolor eligendi voluptate fuga. Soluta dolores maiores nobis. Dolores quidem vero neque.,Voluptatem at possimus.,2020-01-15T13:00:18.328Z,2076-12-30T09:17:58.952Z,positive
Amber Gulgowski,Molestiae assumenda praesentium quidem eius minus tempora placeat quas. Iure voluptas magnam eum dolorem autem eos deserunt magni. Cumque sit distinctio saepe officiis libero quia. Repellendus labore esse. Modi dolor voluptatibus.,Labore soluta facilis.,2013-08-24T14:38:33.863Z,2097-10-13T01:13:46.087Z,positive
Earl Gorczany,Libero sequi incidunt dolor quis saepe esse harum. Harum maiores nulla perferendis saepe in nihil. Suscipit atque officiis omnis. Unde culpa quidem sapiente. Id vero assumenda illum alias. Animi harum repellat perspiciatis maiores autem eveniet.,Quia impedit quas fugiat repellendus quibusdam natus saepe.,2015-06-08T10:26:33.633Z,2018-02-22T09:36:59.640Z,positive
Kristopher Sipes,Veniam consequuntur quos in unde qui consequatur. Mollitia nostrum eum possimus inventore odit hic nihil in culpa. Sequi nobis fugiat. Earum nam beatae. Repellendus explicabo magni. Asperiores error soluta dolor reprehenderit dicta.,Occaecati autem culpa facere accusantium quae illo alias qui.,2013-10-04T01:54:12.735Z,2075-04-24T10:37:13.906Z,neutral
Terrence Welch,Ipsa mollitia velit neque tempora nemo quaerat optio. Ex vero debitis praesentium placeat necessitatibus. Corporis ratione magni nesciunt dolores nulla debitis. Corrupti quae quibusdam voluptatem autem illum.,Tempora accusamus totam ratione porro magnam laudantium facilis voluptatem.,2016-12-20T12:14:11.038Z,2013-06-09T13:01:47.035Z,neutral
Jodi Turcotte,Pariatur quisquam amet nemo accusantium totam fugit recusandae eveniet. Minus quis ea harum quos ipsum aperiam dolorem sapiente. Quis ullam hic delectus eligendi laborum adipisci. Possimus praesentium iusto facilis repellat totam. Commodi laboriosam praesentium et temporibus sapiente.,Temporibus facilis voluptatum.,2018-01-27T20:00:58.883Z,1994-08-22T07:05:50.890Z,neutral
Dr. Horace Grimes,Minima consequatur amet eos asperiores deleniti. Enim corrupti nesciunt modi rem suscipit laboriosam inventore repellat. Omnis commodi repudiandae sint odit nesciunt ducimus maxime. Autem nostrum numquam ducimus quas architecto mollitia error. Vero rem possimus nemo.,Repellat voluptatibus impedit est commodi.,2016-12-31T12:37:02.473Z,2099-04-24T20:41:30.307Z,neutral
Andrew Gleason,Ex quas vel molestias ab eligendi. Nobis labore beatae ratione sunt ab voluptates aut saepe. Maiores nam dicta voluptates nulla tempora consequuntur qui sapiente eveniet.,Magni odio molestias.,2018-03-06T21:23:04.253Z,2041-04-07T04:28:11.829Z,positive
Shelia Kerluke,Corrupti possimus ducimus expedita. Adipisci tenetur culpa maxime. Adipisci libero expedita.,Asperiores quos veritatis pariatur amet eum vel.,2021-08-11T03:51:04.846Z,2065-10-24T03:26:44.243Z,positive
Javier Douglas,Harum velit sit itaque quisquam. Consequuntur delectus optio ducimus recusandae ducimus consequuntur animi. Odio voluptates amet eligendi autem. Quia sit debitis voluptates inventore nostrum et consectetur magni doloremque. Deleniti natus voluptatum temporibus voluptatibus facilis consectetur velit reiciendis aliquid.,Vero aut itaque sequi debitis aut ad.,2017-09-11T07:22:46.401Z,2079-08-09T08:01:43.695Z,positive
Cassandra Schowalter DDS,Laudantium laboriosam velit nam quo optio maxime. Velit facere eos quidem. Hic nam maiores aliquam consectetur nostrum sunt incidunt voluptatem. Magni magnam veniam dicta voluptatibus alias vel ullam. Veniam illo occaecati.,Molestias quidem maxime tempore voluptas vero.,2019-02-12T17:36:41.219Z,1996-10-11T23:30:40.005Z,negative
Benny Borer,Eius quaerat earum modi mollitia architecto eligendi eveniet perferendis. Repellendus ipsa voluptates mollitia. Quis doloremque tempora natus praesentium ipsam quae. Distinctio quisquam harum ducimus ea libero porro sequi culpa.,Eaque quasi unde error similique necessitatibus possimus quasi atque.,2015-12-17T04:44:40.796Z,2065-09-21T19:15:54.714Z,negative
Daisy Toy,Molestiae quis hic nam necessitatibus. Aliquid fugiat labore aliquam dolorem deleniti iste ea. Maxime corporis ratione. Harum expedita odit quae.,Laboriosam ullam explicabo vitae velit quam cupiditate itaque.,2015-12-31T18:13:26.794Z,2062-03-07T22:34:52.508Z,positive
Travis Donnelly,Recusandae reiciendis ipsa iure. Deserunt culpa officia fugiat. Beatae asperiores earum rem modi placeat error. Eius laudantium veritatis cupiditate totam repellat incidunt qui rerum ipsam. Modi cumque sunt consequatur minima animi. Ea dolor eaque reiciendis.,Perspiciatis beatae modi voluptate perferendis iste amet illo.,2016-03-17T00:05:42.146Z,2086-03-31T07:58:51.246Z,positive
Jacqueline Bernhard,Adipisci eligendi nisi et aperiam non inventore quidem excepturi. Eveniet natus eius voluptatum voluptatum nobis. Dolorem aut vero eveniet atque corporis vero aspernatur. Amet aut tenetur odit natus ipsa corporis fugiat. Quaerat asperiores eos. Dolorem quidem fuga.,Eaque tempore qui perspiciatis officiis facere iste excepturi saepe.,2014-02-18T05:52:38.881Z,2026-05-11T06:29:44.930Z,negative
Dr. Carrie Kub,Neque veniam illum officia consequatur. Corporis nostrum deleniti quibusdam cumque aperiam nemo eum iste rerum. Perferendis occaecati sed consequuntur nostrum beatae.,Cumque aspernatur mollitia aperiam repellendus.,2020-01-03T07:06:34.220Z,2028-01-18T14:13:57.630Z,negative
Alyssa Beatty,Amet nam nam deserunt temporibus. Vitae nam nam minima illo non debitis numquam ipsa ipsum. Sint magnam officia perspiciatis molestiae dicta assumenda sequi dicta. Velit quod enim. Incidunt iusto eaque. A eveniet officia perferendis rerum rerum.,Optio sapiente fugit cumque harum ducimus dicta perferendis.,2016-01-18T22:42:13.253Z,2043-03-25T17:45:21.802Z,neutral
Francis Kautzer,Molestias aperiam necessitatibus ipsum tempora. Eius maiores natus labore corrupti aut corrupti a. Quam temporibus dolorem.,Quasi reiciendis facilis quos.,2018-09-06T15:11:43.770Z,2019-05-29T16:32:23.819Z,neutral
Myron Marquardt,Quas vero iure quod laboriosam iste deleniti. Ratione perferendis officia labore ullam eius sint eaque. Minima inventore maiores modi reprehenderit repellat. Et itaque amet expedita ullam beatae sit eaque consequatur. Nobis vitae ab illo nostrum cupiditate facere dolore ad quia.,Ipsa cumque rerum suscipit esse.,2018-03-02T09:35:05.894Z,2091-01-11T01:39:34.890Z,positive
Mario Wiza,Ratione quisquam delectus eaque exercitationem. Provident officiis ipsum reiciendis doloremque perferendis harum cupiditate dolor sit. Enim neque voluptates non minima possimus quisquam.,Nihil nam aut in laboriosam.,2015-10-11T02:50:04.573Z,2054-02-26T20:38:20.171Z,neutral
Elizabeth Emmerich,Magni nam itaque. Blanditiis itaque quam labore veniam. Aspernatur reiciendis unde maiores maiores molestiae. Adipisci quasi laborum maiores voluptate ut ipsam. Excepturi recusandae nesciunt quas ullam.,Praesentium reprehenderit eum non nostrum.,2018-08-08T00:04:15.391Z,2067-11-02T12:07:35.789Z,positive
Simon Armstrong,Consectetur quis culpa iure corrupti sint. Voluptas totam labore doloremque dolor. Sit fugit hic nisi doloribus similique voluptatem. Dolore tenetur itaque autem.,Nemo aspernatur aliquam ducimus dolore.,2017-03-18T14:40:42.291Z,2038-02-16T04:33:01.156Z,positive
Kristy O'Conner,Dolorem perferendis eligendi. Rerum laudantium incidunt quidem aliquid in numquam magni beatae. Consequatur dolor iure facilis nisi eius. Eligendi soluta consequatur. Dicta eos nulla numquam illo laborum esse voluptates consequatur soluta. Facilis rerum nesciunt repellendus consequatur nisi voluptas deleniti aspernatur.,Accusamus officiis animi natus veniam dignissimos voluptatem.,2016-09-21T07:21:49.884Z,2045-07-09T05:41:47.094Z,negative
Terri Towne,Modi deleniti quisquam facere totam rerum nesciunt mollitia. Officia beatae doloremque doloremque quia delectus saepe exercitationem. Facere eum commodi aperiam voluptate totam. Sapiente vero itaque voluptate accusantium aperiam porro. Earum possimus eos atque.,Aut aliquam adipisci numquam mollitia corporis.,2022-06-20T23:05:38.361Z,2003-09-18T16:54:20.567Z,neutral
Santos Green,Esse sequi sit alias temporibus voluptate. Cupiditate quae consequuntur fugiat provident libero voluptas amet optio reiciendis. Asperiores nihil similique perferendis. Expedita sunt doloremque.,Consequatur asperiores sit repellat sequi inventore ab aspernatur incidunt.,2019-10-25T04:00:09.840Z,2015-07-15T00:42:00.264Z,negative
Frankie Mayer,Aspernatur deleniti temporibus. Quasi quisquam perspiciatis. Illum nobis enim quia possimus dolore facere. Dolor magnam quidem. Esse at itaque beatae magnam. Doloremque tempora impedit dolore veritatis cum non incidunt quae facere.,Deserunt dolorem nihil occaecati sapiente porro pariatur accusantium.,2018-08-27T04:08:37.500Z,2059-01-09T04:00:16.063Z,negative
Gerard Keebler,Quaerat veniam eum harum. Ipsa nostrum aut nihil fuga et ullam sit repudiandae nam. Mollitia expedita voluptatibus rem sit omnis maxime et nam. Architecto ea culpa animi laboriosam tempora perspiciatis quo. Minima quasi vel exercitationem repellat corrupti nulla. Ipsum reiciendis vel provident soluta placeat saepe eligendi pariatur corrupti.,Dolorum blanditiis inventore provident minus modi vero ratione nesciunt.,2020-01-13T18:33:59.534Z,2098-07-12T20:59:08.613Z,positive
Jimmie Watsica,Porro et repudiandae blanditiis dolores quis in illo. Ullam veniam dolorum sequi eius enim. Tenetur facilis adipisci excepturi non deserunt. Odit ipsum ipsum consequuntur. Alias adipisci dolore esse saepe quibusdam placeat quasi ea facere. Et laboriosam ipsa laboriosam.,Unde explicabo quibusdam eaque eum quas.,2018-08-08T05:08:07.086Z,2023-01-10T19:31:55.439Z,neutral
Ms. Olivia Schinner,Nam aliquid aspernatur quia laboriosam nobis dolorem itaque a fuga. Corporis aliquid corrupti cupiditate beatae labore corrupti perferendis. Vitae ex nostrum fuga. Numquam error sequi eos eveniet doloremque aut vitae explicabo incidunt.,Fugiat alias atque cupiditate eaque.,2018-12-06T18:12:28.798Z,1990-03-09T17:37:12.839Z,neutral
Vincent Wisozk,Deleniti fuga eligendi in optio labore. Beatae eos molestiae enim ut asperiores atque. Voluptas officiis labore. Recusandae quasi repudiandae assumenda assumenda modi explicabo voluptatibus.,Pariatur corrupti blanditiis sapiente fugit libero.,2020-11-12T19:04:02.407Z,2062-01-02T06:59:25.656Z,positive
Ms. Sherry Monahan,Eaque natus dolorem odio perferendis nesciunt necessitatibus error. Aliquid qui aspernatur nostrum veniam quo numquam a aliquid molestiae. Sapiente fugiat iste totam omnis reprehenderit consectetur.,Dolores aliquid voluptatibus illum facilis cum aliquam delectus.,2022-06-17T20:07:56.260Z,2003-12-16T08:39:57.243Z,negative
Benny Murazik,Tenetur voluptatibus nemo quos quisquam. Nam doloribus nesciunt. Ratione fugit aut unde nostrum ipsa.,Magni labore consequuntur quibusdam aliquam exercitationem corrupti consectetur ipsum magnam.,2022-02-16T13:51:20.972Z,1998-01-30T10:06:34.777Z,positive
Rachael Crona,Fugit ipsam sit eum dolorem. Soluta sit ipsum quidem placeat aliquid facere necessitatibus unde est. Molestias sequi dolor architecto dolorem dolores accusantium laudantium occaecati exercitationem. Autem natus nisi minima voluptatum corrupti commodi. Quis cum neque.,Assumenda blanditiis cum optio blanditiis a delectus repudiandae commodi dolore.,2019-09-23T16:46:11.026Z,2044-01-17T16:11:30.780Z,positive
Elbert Gerhold,Quis repudiandae facilis illo perferendis tenetur quia reiciendis perspiciatis. Laboriosam veritatis ullam necessitatibus porro consequuntur nihil debitis impedit eveniet. Eaque quae vel omnis quo nesciunt exercitationem dolorum voluptatum. Quod rem eos dolorum expedita eos nihil sint.,Mollitia adipisci ipsa necessitatibus odit reiciendis fugit sunt.,2013-05-02T10:11:42.235Z,2074-11-02T03:05:09.976Z,neutral
Jose Medhurst,Perspiciatis repellendus maiores id exercitationem eaque accusamus. Incidunt iure officia inventore. Enim dolores cupiditate porro necessitatibus sed est consectetur exercitationem pariatur. Nulla veniam odit placeat repellat temporibus exercitationem nemo ipsum enim. Ex nobis error consequuntur. Repellendus sint maxime.,Dolorum quisquam non quibusdam quis omnis labore.,2022-04-03T00:41:36.423Z,2045-04-26T00:49:45.392Z,positive
Miss Janis Jerde,Culpa sequi atque repudiandae explicabo ad occaecati numquam a nisi. Odit necessitatibus nisi id praesentium repellat. Ut nobis dolore veniam. Occaecati aperiam aliquam animi illum nemo excepturi corrupti dolor ea. Eum quidem eaque maxime cum eaque nisi voluptatibus ducimus.,Voluptatem in distinctio quisquam commodi ipsam occaecati qui.,2013-05-12T15:52:27.579Z,2017-09-28T10:04:32.692Z,positive
Rosie Effertz,Atque amet temporibus alias. Modi rem soluta. Deserunt nam saepe. Saepe deleniti cumque incidunt. Mollitia sequi rem eos dolorum nisi fugiat. Cum a rerum error qui explicabo delectus.,Mollitia magnam enim.,2015-07-13T23:00:12.643Z,1999-02-14T17:39:31.257Z,positive
Milton Rowe,Maxime quasi cupiditate nulla saepe similique facilis quidem molestiae. Illum natus aperiam voluptates. Dolore expedita aperiam quibusdam eos commodi. Quas magni maiores ipsam odit officia ea exercitationem maiores cum.,Nobis facere ex ab quod.,2017-04-13T10:59:14.585Z,2017-11-11T08:09:10.766Z,positive
Neal Pfeffer,Dignissimos nulla ducimus. Id labore fugiat nostrum officia dolorum dolorem voluptatibus esse culpa. Magni labore reprehenderit illo explicabo eligendi doloremque odio delectus fuga. Totam quas incidunt ab aliquid illo quia amet explicabo. Porro nostrum inventore. Quos in illum laborum.,Quaerat iste aliquid porro magni exercitationem a sed.,2015-06-25T01:37:11.890Z,2029-04-21T22:13:13.829Z,negative
Glen Christiansen,Aliquid accusantium cum rerum corporis ipsum reprehenderit quia. Accusamus quas rem tenetur non sequi. Amet sunt quibusdam voluptatum. Assumenda cupiditate exercitationem dignissimos. Harum ab ducimus.,Harum rem sint molestiae commodi.,2023-04-06T07:14:25.554Z,2016-09-13T12:39:49.112Z,neutral
Alfonso Breitenberg,Ab rerum neque natus aliquam illo a. Quod at saepe. Expedita vel tempora unde sint ut quis id alias. Architecto tempora nemo dolorum dolores.,Odio nihil vero.,2019-03-27T02:30:44.718Z,2076-12-18T22:25:50.915Z,positive
Troy Mohr,Quidem alias magni deserunt consequuntur nulla ut. Recusandae tempora ut reiciendis quo. Ipsam deserunt repellendus consequatur ad voluptates minus laudantium. Soluta explicabo praesentium consectetur ea praesentium facilis quae.,Reiciendis vero esse placeat nemo quod blanditiis adipisci saepe modi.,2013-06-28T02:25:12.944Z,2000-03-03T20:51:14.319Z,neutral
Tomas Yundt,Consequatur occaecati deleniti commodi soluta tempore molestias eos. Cupiditate modi eius repellat architecto culpa molestias nam. Sapiente repellendus architecto laudantium maxime recusandae architecto itaque.,Qui soluta animi.,2016-04-27T19:43:25.340Z,2064-09-21T23:28:45.765Z,positive
Marlene Swift,Error saepe ratione. Corrupti ea amet a debitis expedita. Repellendus eveniet nam. Omnis repellat magnam molestiae a architecto. Vero asperiores rem consectetur quasi atque. Laborum iste natus occaecati placeat possimus.,Beatae consectetur cupiditate ex ipsum.,2013-07-05T04:42:02.234Z,2047-10-24T22:02:09.406Z,neutral
Wilson Hilpert,Eos perferendis nulla odit. Veritatis assumenda sint blanditiis nihil. Vero nostrum blanditiis autem. Ea nihil aliquam eligendi similique officia hic quasi ut repudiandae.,Ad pariatur inventore.,2020-05-10T06:59:22.511Z,2001-10-14T18:15:40.590Z,negative
Martha Feest,Fugit ullam aliquid recusandae non quisquam animi a. In iure laboriosam. Id necessitatibus inventore doloremque aut velit.,Maxime eveniet deserunt magnam quam est odit aperiam.,2023-01-26T01:37:33.290Z,2087-02-18T02:46:31.031Z,negative
Orlando Ratke,Similique magni fugiat quisquam repellendus natus fugit. Voluptate quos minus. Quod nesciunt consequuntur ut necessitatibus totam facilis. Quia illum necessitatibus fugit distinctio dignissimos beatae. Dolores eligendi neque in quae molestias doloremque. Velit id numquam natus cum.,Alias blanditiis veritatis.,2022-12-10T07:41:29.475Z,2013-12-21T21:19:17.760Z,positive
Dr. Sandra Bayer,Ad ipsa adipisci ipsa doloremque. Laboriosam architecto saepe. Optio quas ipsa accusamus ratione officia molestiae. Optio officiis dignissimos libero iure labore reiciendis quisquam. Quo atque sunt quos velit possimus alias. Officiis placeat similique eos et tenetur aliquam nemo cupiditate dolores.,In veritatis assumenda maxime porro quod sit fuga unde.,2017-04-11T11:10:39.922Z,2087-05-11T18:50:00.114Z,neutral
Angel Goyette,Maxime repudiandae natus quisquam magnam nostrum rerum ratione nesciunt repellat. Quasi in commodi accusantium. Ut tempore magni iusto error officiis.,Dolor iure mollitia aut distinctio.,2021-05-01T12:44:31.313Z,2067-04-22T14:41:25.778Z,negative
Della Johnson,Fugit eligendi inventore beatae doloremque nisi autem voluptatum suscipit ab. Quae quaerat modi voluptatem ipsa iure enim mollitia ex. Sapiente tempora modi distinctio natus maxime earum autem officiis. Alias porro architecto.,Magni est neque quidem ex.,2020-12-29T03:43:26.962Z,2013-04-14T09:32:45.923Z,neutral
Carl Hilpert,Tenetur eius earum. Delectus earum velit laborum dolore incidunt. Delectus voluptatum debitis.,Laudantium architecto magni.,2013-06-04T10:06:17.896Z,2079-03-25T19:17:07.885Z,neutral
Randall Tillman,Quo iure repellendus iure illum blanditiis sit odio. Laudantium voluptate quasi rerum quisquam corporis. Repellendus repellendus libero iste. Rem fugiat porro nostrum officiis voluptate aliquam.,Eius sit vero eius modi.,2015-04-03T15:00:43.563Z,2014-03-28T16:55:42.406Z,neutral
Dexter Kuhic,Corrupti amet omnis explicabo ex dignissimos iusto quia nisi sequi. Nihil deserunt atque dicta assumenda alias voluptas. Odit fugiat accusantium. Aspernatur perspiciatis exercitationem. Reprehenderit sequi eos. Ipsam doloribus sequi enim quaerat.,Fugit illo reprehenderit voluptate molestiae similique.,2013-05-28T20:43:46.444Z,2075-12-08T05:50:37.320Z,positive
Esther Dicki,Impedit rerum repellendus quidem iusto reprehenderit aperiam. Dignissimos corrupti eos in. Ipsa cum omnis saepe aperiam nemo unde iure amet blanditiis. Soluta repellat temporibus. Libero deleniti laudantium impedit dolore velit. Consectetur deserunt aut quo totam voluptatum unde consequatur.,A ea doloribus expedita dolorum maiores aspernatur quo.,2015-11-08T01:34:15.695Z,2044-10-21T14:24:00.945Z,neutral
Mamie Lynch,Necessitatibus eos blanditiis voluptatibus minus tempora dolorem. Laboriosam cum adipisci corporis necessitatibus ullam. Eos beatae asperiores consequuntur dicta placeat ad illum molestiae. Aspernatur fugit cupiditate nemo. Suscipit consequuntur quis.,Consequatur dolorum eligendi unde sed magni vitae in et.,2018-12-16T02:22:16.808Z,2047-10-31T00:03:51.002Z,negative
Gail Veum,Inventore laudantium fuga hic unde. Voluptatem error non distinctio. Doloribus explicabo eaque aspernatur labore porro dolorum. Nisi numquam voluptates nulla accusamus. Veniam dolores dolore quam delectus voluptatem iusto.,Fuga eligendi occaecati illo saepe tenetur sit cumque.,2014-02-17T14:06:16.698Z,2086-01-03T01:06:21.508Z,positive
Christian Moen Jr.,Odit fugit voluptatem autem a molestias. Officia illo quidem dolorum expedita distinctio cumque quos vero vitae. Expedita voluptas corrupti itaque a. Placeat aut sequi sequi nihil.,Repellendus magni ea laborum debitis.,2014-03-12T22:49:52.258Z,1998-09-06T19:58:55.009Z,negative
Bonnie Terry,Sit veritatis eligendi doloribus asperiores natus inventore provident. Temporibus maiores nesciunt deleniti libero accusantium officiis maxime ad. Labore maiores esse esse nesciunt. Velit omnis accusantium qui nam quam. Molestiae illum assumenda atque quidem temporibus. Iste nemo quia distinctio.,Optio iure optio animi laborum tempora.,2022-09-23T09:59:35.839Z,2011-12-20T03:28:25.636Z,negative
Paulette Crona,Dignissimos omnis veniam debitis voluptate quae. Rerum suscipit deleniti consectetur voluptas voluptates aliquam quas dolores. Voluptatum accusantium odit quisquam rem. Dolorem at neque recusandae.,Consequuntur quam ipsum eum.,2021-03-30T11:43:54.691Z,2038-07-23T23:56:51.055Z,positive
Colleen Weimann,Doloremque eius numquam dignissimos molestias. Ab odio voluptas praesentium necessitatibus itaque officia reiciendis. Eveniet autem voluptatem ipsa deserunt velit eum.,Unde ratione ullam libero.,2016-10-13T21:36:16.129Z,2028-07-07T00:26:35.933Z,negative
Mrs. Horace Champlin,Tempora provident voluptatibus aliquid blanditiis modi. A saepe non harum ullam. Minima quam exercitationem unde dolorem iure error. Animi dolorem amet quo magni.,Dolores laboriosam fugit natus quam ea minus ut sint.,2017-03-25T06:07:21.298Z,2071-03-10T15:35:19.985Z,neutral
Adam McLaughlin,Ex architecto quisquam quibusdam debitis assumenda. Unde aperiam dolores velit nesciunt. Quo qui officia consequatur cum unde quo reiciendis nihil. Excepturi et reiciendis. Sed vitae possimus odit quas eum natus nobis optio beatae. Nihil explicabo quia illum expedita magnam excepturi.,Illum dolor suscipit fugit quas dolore nisi tempora est.,2015-01-19T04:03:27.667Z,2070-07-26T09:04:51.108Z,positive
Christie Johnson,Eius iste omnis unde. Laboriosam asperiores blanditiis ex. Sequi consectetur inventore perferendis ipsum voluptatem recusandae amet. Facilis natus nemo consequatur natus sequi quod. Voluptas voluptatem voluptatibus libero perspiciatis eos sunt exercitationem.,Voluptatum nihil voluptatem laudantium et minima sequi.,2017-01-29T08:55:47.910Z,2018-01-31T17:51:55.533Z,negative
Miss Kayla Goldner V,Necessitatibus quas reiciendis nesciunt. Unde reiciendis delectus est. Neque quo a sit qui repellendus. Vitae voluptatem tempore fugit repellat.,Excepturi natus eum a.,2020-08-24T06:27:35.177Z,2075-12-19T14:05:33.390Z,neutral
Dallas Hagenes,A rerum architecto. Sit earum nemo dolores eaque. Quisquam fugiat facilis reiciendis. Possimus placeat eum voluptates porro illum magni eos odio est. Ullam architecto necessitatibus similique quaerat.,Eos eum dolore veniam omnis nobis libero modi saepe perspiciatis.,2022-12-23T06:20:46.565Z,2013-03-06T05:37:42.142Z,positive
Nadine O'Kon,Labore quod sit delectus officiis consequuntur veritatis. Nam tempore animi autem eius possimus fugit recusandae fugit. Omnis ea provident facilis eaque laudantium dolores recusandae.,Aliquid itaque debitis.,2019-01-30T13:05:54.072Z,2084-09-14T00:44:48.303Z,negative
Lorenzo Bergstrom,Earum eaque quam. Hic ipsum et voluptatibus doloremque quibusdam delectus corrupti eligendi qui. Magni molestiae excepturi culpa voluptatum modi odio sint ad. Soluta placeat occaecati deserunt facilis dolores. Voluptatum temporibus nemo nesciunt nam odio distinctio blanditiis enim. Provident error veritatis soluta dolorem tenetur nobis accusamus aspernatur.,Provident veniam nam in magnam.,2015-03-21T22:05:37.980Z,2047-10-22T23:36:49.834Z,positive
Miss Candice Roberts,Est ea nobis dolorum tempore delectus provident sapiente hic. Enim cumque sit enim aliquid laudantium illo voluptatem. Provident suscipit modi quisquam.,Quam necessitatibus quasi asperiores distinctio quaerat inventore ducimus repellat.,2021-06-20T11:34:15.767Z,2031-05-16T08:29:05.634Z,negative
Francis Walker,Impedit similique minus officia minus laudantium eveniet. Animi odit minus nobis laudantium quis molestias explicabo asperiores laboriosam. Laborum nemo id doloremque. Labore voluptas ipsam nemo molestias voluptatem.,Nam corrupti tenetur placeat ratione aliquid non fugiat.,2022-07-28T23:45:00.163Z,2078-03-09T03:43:25.223Z,neutral
