Respondent,Feedback,Suggestion,Date Submitted,Time Submitted,Feedback category
Sheldon Sawayn,Hic ipsam optio officiis molestiae autem totam dignissimos dolorem. Omnis suscipit eveniet odio dolorum placeat provident quasi. Dolorum officia minima debitis. Assumenda deleniti quidem asperiores alias at et veritatis rem consequatur.,Ipsam repellendus excepturi saepe architecto fuga quasi placeat optio.,2021-10-30T01:48:14.352Z,2069-12-22T07:20:19.524Z,neutral
Mr. Christy Walter,Modi debitis saepe laudantium dolorem consequatur aspernatur atque itaque. Aliquid sint earum maxime. Dolorum id facere error aspernatur occaecati. Rerum eaque debitis explicabo esse. Aspernatur cumque nobis deserunt esse blanditiis molestias voluptatibus facilis numquam.,Voluptatibus ducimus assumenda porro.,2018-10-23T17:37:26.589Z,2072-12-26T12:35:29.269Z,neutral
Al Bode,Earum molestiae exercitationem temporibus repudiandae. Tempora est expedita nostrum ratione. Et possimus non provident aut quos labore odio sed. Quisquam quas porro necessitatibus vel quae nemo accusantium magni.,Amet praesentium facilis eligendi.,2023-04-15T07:19:32.965Z,2070-12-13T15:39:58.499Z,neutral
Shannon Gorczany,Reprehenderit provident reprehenderit sapiente ullam odit consequatur sequi similique. Doloremque ex autem nam maiores. Quas labore architecto consequatur. Voluptatibus expedita excepturi. Sit assumenda tenetur. Aliquam hic praesentium ipsa.,Quam repudiandae tempora unde sequi quaerat.,2013-10-17T01:39:49.866Z,2005-05-06T05:02:25.704Z,positive
Tony Gerlach IV,Quod voluptatem harum tempora tempora alias accusantium laborum. Culpa repellat molestias totam facilis. Odio omnis itaque maxime ipsa possimus cupiditate. Sequi non recusandae molestias sunt iure occaecati. Culpa officiis nam at. Ab sunt natus quisquam ea.,Ut exercitationem saepe beatae consequuntur similique consequuntur veritatis.,2015-03-26T07:52:50.203Z,2017-03-30T14:19:10.020Z,neutral
Wilfred Douglas III,Consectetur velit culpa. Provident consequatur expedita magni porro asperiores enim cumque. Nisi laborum laudantium a amet eos. Accusantium sed illum sequi debitis sed quam voluptas repellat ex.,Cumque blanditiis nam fugiat illo sit illo.,2015-02-03T03:08:56.742Z,2002-07-07T13:29:18.145Z,positive
Darlene Kerluke,Perferendis aspernatur ab ut. Architecto itaque sit praesentium. Molestiae aut magni fugiat distinctio. Occaecati amet quae dolorem dolorum.,Quas id dolor voluptatum perspiciatis et nobis.,2018-12-28T15:58:37.293Z,2096-08-05T06:26:11.904Z,negative
Patti Hagenes,In veritatis alias autem architecto pariatur adipisci quaerat corrupti. Fugit similique autem quae. Harum explicabo temporibus cum ut provident sit expedita vel. Quae itaque nesciunt. Incidunt exercitationem sapiente. Aliquid ipsum asperiores tempore accusamus dolore reprehenderit mollitia optio nemo.,Veniam mollitia accusamus qui temporibus amet.,2015-08-04T00:13:04.562Z,1994-12-13T21:47:08.606Z,positive
Kristi Pouros PhD,Ullam labore enim aperiam ratione odit qui quaerat omnis fugit. Harum impedit perferendis a fugit distinctio exercitationem. Voluptas animi laborum consectetur suscipit distinctio vitae voluptate ipsam. Tempora pariatur aspernatur nisi nulla neque. Ex ipsum amet explicabo.,Distinctio eaque similique explicabo debitis qui molestiae.,2016-12-19T03:22:07.302Z,2096-10-16T23:29:58.148Z,negative
Brandon Mitchell,Dignissimos eos dolor iste non. Voluptatem sapiente pariatur earum tempora suscipit amet. Sed maxime fugiat vel dolorem. Adipisci fugiat nostrum a quae. Iure exercitationem enim consectetur minus. Distinctio quam facere pariatur iusto cumque dolores enim labore sit.,Magni ex ullam nostrum delectus nostrum occaecati nostrum maxime explicabo.,2013-08-10T23:52:57.397Z,2027-01-28T13:29:43.760Z,neutral
Dr. George Pacocha,Iure assumenda eos hic atque illum. Velit dolorum odio adipisci sunt natus dolorum. Eum facere omnis error quasi beatae voluptas ipsa quis. Officia laboriosam unde quasi. Quod ad officiis inventore rem cum.,Iure hic amet tenetur repudiandae tenetur tenetur maiores.,2018-12-16T23:53:22.519Z,2040-01-17T18:22:21.540Z,positive
Wanda Block,Pariatur assumenda occaecati soluta minima. Unde architecto dolorem minima magni voluptatum corporis dignissimos. At aliquam ipsum. Magni aliquid voluptate minima. Est voluptate rerum aliquam inventore.,Hic quos ullam.,2019-06-23T04:12:59.511Z,2054-11-06T23:26:17.388Z,neutral
Homer Mertz,Minima quis ullam vel. Consectetur necessitatibus porro suscipit. Dolore nemo nam officiis perspiciatis ab animi iste. Hic ea ad atque non harum harum reiciendis vitae maiores.,Esse repellendus enim quod cumque quibusdam maiores nam sint.,2022-06-13T17:34:13.625Z,2095-04-20T04:12:58.984Z,neutral
Vanessa Runolfsson,Omnis laboriosam cum autem. Ad odio voluptas. Nostrum eum perferendis.,Saepe tempora tenetur numquam nobis.,2013-07-28T19:30:43.629Z,2074-11-20T20:52:54.925Z,positive
Lucas Koch,Aliquid quam esse cum. Impedit ipsa saepe dignissimos ut nostrum. Rem explicabo accusamus dicta. Nemo animi velit aliquid animi cum ut quaerat. Similique quisquam adipisci. Officiis quisquam laboriosam voluptatem consequatur rem aliquam.,Non pariatur et similique necessitatibus natus commodi iusto.,2014-08-24T22:33:14.450Z,2097-07-05T22:46:41.370Z,negative
Kerry Stamm,Unde vel non reiciendis aspernatur eveniet dicta reiciendis. Nisi officiis odio iure expedita. Non nemo beatae reiciendis ipsum dolorem incidunt. Temporibus enim voluptatum distinctio sit.,Nostrum sapiente maxime doloremque molestias ipsa.,2021-05-23T04:17:05.579Z,2062-06-25T05:32:51.043Z,neutral
Dean Barrows,Officiis ad explicabo magni dolore. Unde rerum reprehenderit. Voluptates a nihil quae architecto nemo impedit ea repudiandae delectus. Dolorem corporis vel accusamus enim quas. Quas amet suscipit velit dolore reprehenderit quos modi nostrum quia.,At minus reiciendis repudiandae impedit nihil odio.,2014-03-09T08:08:38.956Z,2059-05-11T09:38:47.791Z,neutral
Inez Erdman,Quibusdam reprehenderit perspiciatis perspiciatis natus voluptatibus repudiandae beatae voluptas illo. Exercitationem debitis incidunt eius ipsam in. Esse dolorum consectetur saepe eveniet sit alias debitis reprehenderit enim. Culpa expedita dignissimos non facere est sapiente quo. Neque soluta itaque autem tenetur illum deleniti omnis tenetur. Sapiente enim aliquam ut quod odio praesentium dolorem error necessitatibus.,Quasi minus voluptates eaque.,2017-09-26T10:31:46.204Z,2016-09-25T18:47:07.958Z,neutral
Rosemarie Harris,Rerum reiciendis veritatis quibusdam ullam id ratione iusto. Totam neque laudantium. Vitae unde molestias. Ut quaerat eveniet tempora quidem animi ipsum doloribus. Sequi molestiae enim facere nemo officia.,Commodi quasi illo numquam natus laboriosam ipsum officiis itaque.,2014-04-04T03:21:34.319Z,2092-01-01T13:29:23.882Z,negative
Shannon Grant,Ea vel labore. Libero inventore velit. Iusto numquam quis neque quaerat quam veniam. Omnis cum nam. Tenetur molestiae tempore. Odio quia maxime necessitatibus magnam aliquam nobis omnis pariatur.,Culpa ex quaerat tenetur cum ipsum accusamus eaque quos.,2022-05-21T23:14:49.959Z,2061-12-12T11:56:53.686Z,positive
Corey Schowalter,Quis nam dolor. Deleniti hic est sit voluptatum dolores aspernatur. Cum sint cum. Unde vero eos.,Distinctio enim eius ab ipsa deleniti reiciendis quibusdam assumenda odio.,2019-01-31T21:14:13.749Z,2065-10-04T05:18:34.838Z,positive
Gayle Kerluke,Quod consequatur consequatur possimus dolorem unde similique. Nihil alias enim corporis quo reprehenderit earum unde ad. Necessitatibus modi quibusdam molestiae laborum. Dolorem autem vitae deleniti.,Aspernatur possimus laboriosam.,2013-05-02T12:15:53.901Z,2003-09-08T05:45:45.573Z,positive
Mr. Diane Bins,Ipsam maiores corporis provident nihil consectetur reprehenderit. Enim sunt in ipsam. Laboriosam aut velit facilis libero sit pariatur recusandae. Ad suscipit voluptatem possimus ipsam possimus adipisci porro non. Esse tenetur fugit placeat delectus blanditiis nam. Quam incidunt minima fugiat dolore consequatur.,Optio fugit omnis.,2017-12-11T08:32:53.484Z,2092-06-21T13:49:53.261Z,neutral
Glen Farrell,Doloribus maiores cupiditate. Impedit deserunt necessitatibus corporis totam aspernatur odio. Accusamus perspiciatis consectetur quisquam maxime labore accusamus sequi porro.,Sapiente facere excepturi ipsa nisi optio et consequatur fugit et.,2020-09-04T00:14:36.120Z,2016-07-31T22:22:59.826Z,negative
Woodrow Toy,Delectus eligendi vitae delectus voluptas repellendus quisquam esse recusandae. Nesciunt at adipisci labore quos delectus accusantium impedit voluptatum quae. Voluptates fugit quasi magnam occaecati in perferendis distinctio sit.,Eum facilis eligendi vero dicta quaerat in.,2016-07-29T04:37:02.652Z,2008-11-17T19:53:32.118Z,neutral
Shelia Roob,Voluptas nihil culpa veniam. Reiciendis eligendi nobis maxime voluptas delectus. Ea aperiam itaque temporibus rerum amet. Reiciendis asperiores quibusdam unde fugiat provident.,Provident temporibus incidunt cum perspiciatis accusamus labore consequatur.,2019-05-07T18:39:22.435Z,2003-10-21T15:27:41.445Z,neutral
Edna Roob,Ullam nostrum eaque natus quo temporibus eaque fugiat cumque sapiente. Eligendi sed distinctio corrupti quibusdam unde minima. Ipsum ab voluptate harum molestias debitis temporibus doloribus. Atque delectus rem temporibus doloribus cupiditate dignissimos. Numquam tenetur sed fugit libero.,Asperiores inventore ducimus.,2016-02-21T14:00:23.938Z,2016-05-12T23:52:22.054Z,neutral
Mrs. Pauline Gislason,Laboriosam aspernatur nisi. Optio non architecto alias eaque iure quod voluptate quas. Eum sunt inventore quaerat debitis quas harum.,Dignissimos eos odit eaque quia.,2018-02-25T10:44:30.445Z,2054-04-28T12:35:59.443Z,negative
Clifford Rohan,Accusamus similique neque delectus earum beatae recusandae. Sit consectetur culpa rem qui quidem porro. Repellendus tempora labore. Magni at consequuntur nostrum iste quo fuga. Inventore soluta qui corrupti ipsam officia suscipit cumque eveniet.,Molestiae voluptate vitae reiciendis similique culpa qui.,2015-06-16T05:05:28.278Z,2024-03-23T22:17:41.890Z,positive
Felix Schimmel,Velit enim ipsam eligendi. Quisquam ex quia a atque similique nisi reiciendis quasi. Debitis harum velit doloremque quos. Molestias modi voluptates dicta maxime.,Aliquid incidunt odio.,2020-11-17T06:41:40.409Z,2097-03-16T06:30:36.760Z,positive
Della Hodkiewicz,Laudantium odio deleniti reprehenderit aut praesentium illum vel officia ad. Nihil omnis mollitia totam odio. Sequi magnam eligendi illo. Earum atque ex. Omnis necessitatibus dicta quasi ea temporibus vitae fugiat id voluptates. Impedit delectus delectus voluptatem tenetur voluptatem culpa quasi voluptatibus.,Beatae nisi aliquid occaecati voluptates voluptatum dolore.,2016-01-21T08:45:12.882Z,2012-02-05T10:19:40.042Z,positive
Curtis Beahan II,Explicabo consequuntur deleniti deleniti ipsum saepe velit exercitationem consequuntur itaque. Voluptatum totam fugit iure dolore quas. Numquam eveniet voluptas nam in impedit.,Provident dolores laudantium.,2020-12-19T18:29:25.375Z,2010-10-17T10:26:46.736Z,positive
Dianne Weber,Dolorum maxime expedita illo vero. Fuga molestiae eveniet exercitationem unde omnis sapiente perferendis distinctio ipsa. Repellat laudantium quae quasi voluptatum neque. Ipsum quidem earum libero. Blanditiis ratione hic soluta mollitia. Numquam praesentium vitae explicabo cupiditate.,Amet rerum cupiditate.,2016-05-31T04:29:03.404Z,2018-02-12T14:01:44.016Z,neutral
Gail Bosco,Error tempora ad exercitationem. Consequatur doloremque veritatis nam ab ducimus hic eaque doloremque. Laudantium omnis expedita dolorum a facilis.,Error ex magnam.,2016-10-12T01:03:40.927Z,2099-08-30T16:44:12.209Z,positive
Mr. Roberto Mills Jr.,Provident soluta nisi omnis optio. Illum corrupti eius porro aspernatur nulla. Magnam facilis doloremque quam quo laborum quos ipsa rerum omnis. Reiciendis nihil velit. Consequuntur pariatur dolorem aliquid nesciunt iste. Eius repudiandae sunt.,Incidunt adipisci soluta id quos.,2015-06-15T04:44:34.420Z,2068-03-23T08:17:50.274Z,neutral
Patsy Dickinson,Officiis dolore ab quos veniam sapiente. Doloribus vel tempora dicta. Debitis voluptate odit. Aperiam officiis eveniet. Perspiciatis id possimus ad hic ratione.,Ipsa autem excepturi vel voluptate optio magni.,2013-08-09T06:48:01.321Z,2071-05-18T17:34:31.959Z,positive
Malcolm Boyer,Error odit quidem natus vel perferendis perspiciatis tempore consectetur libero. Dolorum consequatur unde. Autem nam possimus quidem sunt molestiae non vitae. Repudiandae dolor dignissimos in nemo mollitia reiciendis id.,Quo consequuntur laboriosam.,2015-03-02T02:53:43.844Z,2066-02-28T22:42:32.720Z,negative
Iris Harris,Ratione qui deleniti minima distinctio debitis. Debitis ipsam accusamus porro quos odit ex ducimus consectetur. Aliquid odio qui recusandae culpa. Amet enim at quos necessitatibus voluptatibus necessitatibus dicta id cumque.,Accusamus delectus et.,2013-06-06T09:49:44.771Z,2053-07-09T18:59:35.572Z,negative
Ted Balistreri,Veritatis quasi ipsum minus ut. Illo omnis harum amet possimus nulla reprehenderit repellat. Eaque a sit quaerat.,Saepe delectus qui illo reiciendis cum nobis.,2022-09-05T13:01:22.812Z,2016-02-15T06:36:30.165Z,negative
Marlene Olson,Magnam adipisci saepe. Voluptas esse cum fugiat beatae. Ut voluptatum numquam repudiandae alias culpa autem ipsum veniam ipsam. Cupiditate ut ea aliquid quasi vero id aut aspernatur a.,Delectus tempora saepe nisi.,2014-05-15T17:40:58.221Z,2091-10-29T01:34:47.852Z,positive
Lamar Sporer,Error aut quis necessitatibus praesentium optio in recusandae. Repellat error perferendis facere eaque repellat blanditiis assumenda vitae. Blanditiis deleniti culpa possimus quod eveniet nam itaque repellat cumque. Placeat perspiciatis officiis delectus sapiente ea hic est assumenda quisquam.,Porro impedit asperiores libero quae.,2019-09-06T15:38:39.812Z,2063-05-04T16:30:42.785Z,negative
Owen Grady,Ratione assumenda dolorum in id. Placeat culpa quasi amet. Neque quo nemo.,Enim illum iusto nulla.,2017-01-20T18:09:55.363Z,2042-04-29T14:08:14.693Z,neutral
Mr. Carrie Metz,Commodi ea porro nesciunt aliquam id magnam voluptas nesciunt cupiditate. Quisquam rem inventore accusantium saepe omnis. Excepturi assumenda esse sequi excepturi sit illo atque beatae.,Harum debitis quod officiis minima perferendis consectetur dolore.,2021-06-22T14:17:30.015Z,2086-11-27T21:09:16.252Z,negative
Darren Purdy,Expedita similique praesentium. Culpa cum quasi blanditiis ducimus esse omnis distinctio minima consequatur. Mollitia tempora voluptatum. Molestiae omnis neque. Deserunt suscipit veritatis quibusdam nisi ullam architecto itaque. Impedit est cumque nulla non optio quaerat sequi ullam hic.,Eius saepe ex dolorum.,2015-11-03T19:22:15.866Z,2025-09-26T21:18:43.530Z,positive
Darnell Bashirian,Cumque excepturi qui incidunt sit. Nostrum sapiente iusto esse praesentium. Aliquid reprehenderit ipsam incidunt voluptatum odit. Ipsam maxime praesentium adipisci doloribus sint ab. Facere dolorum non voluptates omnis nostrum.,Corrupti maiores perspiciatis atque id minus eaque ea debitis dolore.,2014-10-27T08:25:43.803Z,2072-05-05T05:32:55.332Z,neutral
Kurt Schiller MD,Id nostrum dolores dolore nemo dignissimos saepe non sapiente. Recusandae aliquam accusamus vero occaecati facere reprehenderit quisquam quae. Perspiciatis nihil molestiae fugiat rerum delectus. Animi voluptas error suscipit reprehenderit. Ratione enim tempora.,Commodi minima commodi laboriosam est porro sint laboriosam dicta.,2021-11-08T14:13:10.474Z,2073-03-15T09:15:23.563Z,positive
Rosa Romaguera,Nisi vitae ipsum. Eum in quaerat nobis. Cupiditate dolorum exercitationem similique. Tempora voluptatum neque dolores molestiae. Qui veniam velit nemo mollitia harum sit facere rem natus. Illo et neque in optio at ipsam.,Ipsa nisi laborum ullam beatae earum facere quis.,2015-06-10T01:13:43.056Z,2076-01-27T08:20:15.677Z,positive
Angelina Kozey,Similique repellendus veniam eum nobis veritatis. Magnam veritatis nam alias provident omnis doloremque earum. Aliquid esse perspiciatis incidunt cupiditate suscipit veritatis tempore eos optio. Facere praesentium illum unde animi doloremque necessitatibus quaerat repellat animi.,Sed dolorem doloremque illum hic corrupti.,2013-11-30T16:53:13.589Z,2022-05-23T17:22:41.022Z,neutral
Alberto Ryan,Eum aspernatur consectetur dicta ipsam. Suscipit adipisci aliquid quae velit. Ullam sequi repellat itaque esse dolorem quos doloremque. Eveniet provident nam quisquam quos.,Dolorem nisi odit hic placeat voluptatem accusamus iste hic repudiandae.,2018-08-22T08:58:55.571Z,2001-11-03T03:08:34.106Z,neutral
Bradley Lindgren,Aut ipsum autem maiores exercitationem. Recusandae mollitia quidem dolorum eaque repudiandae. Officia corporis laudantium blanditiis nihil assumenda alias asperiores.,Eum at sequi harum.,2016-10-15T10:14:31.635Z,2008-02-11T16:34:01.970Z,neutral
Jacqueline Zulauf,Quod fugiat autem praesentium. Officiis illo doloribus. Architecto inventore velit eius molestiae. Deserunt accusamus voluptatem voluptatum molestias dolore consequatur doloribus voluptate. Voluptatibus et fuga asperiores dolorum fuga asperiores architecto. Voluptates omnis vel sit cumque.,Exercitationem enim vitae aspernatur fuga.,2016-04-01T19:00:58.346Z,2004-01-01T18:57:41.301Z,negative
Mrs. Malcolm Quigley,Sed architecto itaque magnam iure occaecati alias cupiditate aperiam. Dolorem ut minus delectus omnis officia. Possimus nesciunt vitae non nulla corporis quam labore commodi animi. Sint ex id deleniti dicta.,Ullam asperiores saepe ratione perferendis ut labore ipsum.,2019-02-17T18:00:18.363Z,2056-10-11T17:25:19.340Z,negative
Elsie Hettinger,Tempora deserunt laboriosam accusantium aspernatur. Quidem molestiae excepturi ex consequuntur. Aut eius modi veritatis aliquam delectus dolor eius temporibus repellendus. Quas similique quaerat sint quis saepe temporibus earum dolorem.,Fugit voluptatum labore quam quam optio.,2019-01-02T09:27:35.377Z,2024-06-08T12:31:35.970Z,negative
Kelli Gleason,Magni blanditiis ducimus suscipit occaecati alias rerum. Odit deleniti velit totam distinctio sapiente autem. Sunt veritatis praesentium. Doloribus accusantium omnis veniam.,Ipsum itaque fugit quisquam.,2022-09-12T09:03:41.781Z,2073-11-26T13:46:47.584Z,negative
Viola Schamberger,Nostrum optio impedit distinctio ipsam voluptatum officia. Quaerat nobis rerum eius placeat. Officia quas enim quisquam illo accusantium quidem quasi. At quasi ex voluptatem. Officiis laborum officiis quos minima.,At libero libero sit perspiciatis alias eius in pariatur.,2022-03-05T04:21:47.060Z,2003-08-22T03:25:46.889Z,neutral
Martin Schmidt,Nostrum placeat pariatur odit illum. Praesentium eum reprehenderit velit consequuntur et enim distinctio. Facere maxime quos esse ipsum assumenda natus asperiores maxime perspiciatis.,Dolorum repellendus harum ratione architecto ab dolores eveniet ducimus.,2020-08-31T08:26:31.291Z,2054-03-05T00:40:36.982Z,negative
Dianna Goyette,Quos sed provident nihil vero dignissimos. Sint provident accusamus occaecati sunt. Officia deleniti culpa facilis voluptatibus neque earum necessitatibus possimus nam. Et praesentium sunt. Optio laborum dolores ex vel harum quam provident. Quia quaerat pariatur consequuntur eaque est corporis.,Veritatis porro similique nemo sapiente labore.,2021-10-03T09:31:27.376Z,2062-05-07T16:23:52.555Z,neutral
Carlton Cremin,Sit nihil veritatis atque magnam aperiam modi. Fugiat numquam dignissimos dolorum ex ullam ab officiis. Unde aspernatur odio dolores aliquam id eius iusto. Unde excepturi odio numquam vero. Ratione quod omnis non adipisci repellat aliquid corrupti excepturi.,Incidunt optio aliquid aperiam ex cumque et laboriosam.,2015-03-10T14:45:31.187Z,2032-03-15T09:39:35.043Z,negative
Velma Deckow,Quibusdam eos a accusantium rerum facilis aut. Dicta eaque iusto dicta facere in explicabo. Occaecati dignissimos ea facilis itaque. Odit iure error.,Beatae maxime amet occaecati.,2019-11-15T03:06:35.452Z,2079-03-29T09:52:25.078Z,neutral
Lori Gerhold PhD,Alias soluta veritatis cumque animi. Neque nemo a est incidunt distinctio eligendi eaque cumque repellat. Blanditiis ab architecto deserunt tempore minus facere tempora suscipit. Dicta expedita debitis dolorum quis. Est nesciunt earum. Consequuntur quae non iste reprehenderit labore.,Officia laboriosam ipsum rem tenetur excepturi exercitationem.,2015-04-21T02:30:16.456Z,2082-10-16T21:14:54.643Z,positive
Mr. Yvette Corkery,Voluptatum repellat modi sapiente ab quasi minima hic accusamus. Suscipit earum modi autem. Laboriosam voluptatem vitae autem qui quam reiciendis blanditiis corrupti. Nostrum quidem dicta quam excepturi distinctio veniam. Nostrum harum blanditiis quod aliquam suscipit fuga. Nisi quasi recusandae velit ipsam ut voluptate illo.,Esse nihil delectus dolores.,2020-07-20T06:48:41.708Z,2045-01-07T23:36:38.067Z,neutral
Pat Dibbert,Porro nam ipsa sequi beatae illum. Totam nam nam suscipit a qui iste consequatur. Explicabo aspernatur inventore.,Sint sit qui error molestias dolores.,2022-01-14T02:16:12.112Z,2079-05-01T02:08:38.127Z,positive
Clint Jacobson,Perspiciatis fuga id tenetur cumque exercitationem similique placeat occaecati iure. Ipsa explicabo recusandae magni. Explicabo accusantium expedita facere. Maxime consequatur deserunt repellendus. Soluta quos corporis ad odio ex perspiciatis reiciendis nostrum.,Esse doloremque quas voluptates qui.,2020-06-28T09:35:23.814Z,1994-04-06T20:23:16.085Z,negative
Edmund Leffler,Beatae quasi error fuga. In hic quod laudantium itaque sapiente vero. Eligendi ipsa iure veniam tenetur occaecati saepe perferendis. Et dolor ipsa molestias tempore excepturi ullam.,Magni autem id.,2021-02-10T16:14:44.560Z,1996-07-27T03:23:10.063Z,positive
Amanda Kuhlman,Rem nisi aliquam. Corporis ratione repudiandae facere iusto ex itaque distinctio laborum ut. Quod ea ipsum assumenda quos repellat quidem rem eum veritatis. Unde veniam corporis ipsa.,Blanditiis ipsum eius maiores.,2022-07-30T12:43:31.523Z,2042-05-06T13:54:06.047Z,positive
Evelyn Kulas Sr.,Officiis esse recusandae. Ducimus labore officia aliquid vero inventore neque nihil. Minima labore quae facere est. Ut maiores aliquid modi dolore aut cupiditate ex.,Totam occaecati voluptates commodi.,2022-10-07T18:30:23.775Z,2043-06-11T08:32:11.062Z,neutral
Brenda Simonis,Esse vero perferendis doloribus. Consequatur repellendus laudantium saepe exercitationem labore ipsum. Doloribus suscipit sit. Maxime ipsum iste vero ullam nihil itaque. Id ipsa nesciunt pariatur. Dolorum officiis sequi nesciunt voluptas optio in sed.,Autem omnis ducimus distinctio provident illum ratione vel qui.,2019-04-11T01:24:12.767Z,2004-10-13T21:42:31.996Z,positive
Miss Elbert Dare,Alias facilis eum laborum ad illo aperiam assumenda. Atque quam quisquam beatae ab vel eaque sit nostrum. Impedit dignissimos culpa quae repellat tempora esse cum soluta ex. Pariatur at iste quae alias tempora voluptatum dolore. Asperiores sequi deserunt minima sed dolor qui.,Ducimus nihil vitae doloribus reiciendis.,2019-05-22T08:42:28.391Z,2054-09-30T16:25:29.590Z,positive
Santos O'Reilly,Debitis in aliquid deserunt. Amet quibusdam quibusdam non ipsam. Id amet omnis repellat itaque voluptate laboriosam iusto eos. Cumque sunt quis.,Vel dicta vitae nisi maxime itaque incidunt quaerat.,2019-06-14T04:13:59.462Z,2026-04-27T02:00:37.458Z,neutral
Olivia Douglas,Architecto id saepe. Consectetur possimus rem eius voluptates inventore excepturi harum suscipit quae. Nobis magnam incidunt labore quam.,Quos sit commodi in rerum rerum quos cumque.,2016-01-18T05:56:49.773Z,2049-01-20T22:46:48.865Z,positive
Melvin Torp,Voluptate animi expedita enim ipsa natus ipsam ut blanditiis. Laboriosam rem ducimus doloremque deserunt sunt a repellat praesentium quasi. Ipsam aliquam voluptatum suscipit repellendus. Quas inventore praesentium magnam est ipsa. Dolor quod in cum ducimus repellendus atque maiores tempore. Rem error est distinctio.,Doloremque totam molestiae iste fuga.,2019-01-04T00:05:07.436Z,2015-11-16T09:38:15.668Z,negative
Robin Block PhD,Ut quasi quasi soluta architecto adipisci architecto qui. Ducimus alias nostrum voluptate itaque magnam omnis commodi. Tenetur molestias repudiandae nemo aspernatur omnis.,Tempora similique rerum maxime.,2019-11-15T12:00:56.540Z,2058-10-14T05:48:05.568Z,negative
Carrie Sanford,Quae reprehenderit modi accusamus dignissimos hic delectus quae delectus. Totam ipsa architecto reiciendis. Voluptatum quisquam nemo fugit provident delectus nulla facilis praesentium reprehenderit.,Vero consequuntur doloribus consectetur iusto.,2022-07-20T21:06:28.125Z,2007-02-01T01:43:03.098Z,negative
Abel Stroman,Libero odit alias sequi vero nulla at blanditiis quas dolorem. Commodi praesentium debitis. Consectetur eum magnam debitis eveniet. Sapiente ducimus minima quae iste vero alias. Ea porro dolor dolor nihil. Quisquam corrupti libero beatae totam illo necessitatibus iste dolores.,Facere nam doloremque voluptate.,2014-06-09T07:22:05.328Z,2084-10-06T07:14:30.862Z,positive
Estelle Tillman,Nisi iusto officia modi beatae eligendi. Delectus labore earum saepe. Laboriosam eveniet delectus dolorem dolore omnis. Qui architecto perspiciatis saepe soluta.,Deleniti aliquid perspiciatis cum magni distinctio voluptatibus eos aliquid sequi.,2022-06-15T08:24:38.349Z,1994-02-02T03:37:30.190Z,positive
Miss Hubert Orn,Iusto distinctio perspiciatis mollitia ratione sunt. Nam quae eum architecto odio mollitia aut iusto. Qui temporibus optio libero. Aspernatur eligendi illum necessitatibus autem. Vel blanditiis ab unde suscipit eligendi praesentium libero eius. Totam consequatur voluptate nulla atque vitae quia quia quibusdam occaecati.,Praesentium odit animi.,2017-04-02T22:57:05.846Z,2085-06-20T07:20:19.027Z,negative
