Respondent,Feedback,Suggestion,Date Submitted,Time Submitted,Feedback category
Forrest Ondricka,Fuga excepturi voluptatem rem deserunt modi ad. Necessitatibus ab voluptatum tempora cupiditate. Incidunt nihil sunt expedita itaque sit doloremque nisi. Quas dolor minus expedita.,Consequuntur deleniti provident temporibus laboriosam saepe.,2013-11-02T11:29:39.051Z,2043-07-07T01:02:19.017Z,positive
Rex Gusikowski,Nesciunt asperiores maxime laboriosam beatae ab veritatis. Doloribus dignissimos excepturi. Explicabo eaque non perferendis repudiandae eum corrupti accusamus. Quis earum modi numquam quia quia eos fuga ipsa quos. Deleniti cupiditate magni possimus. Voluptatibus non temporibus blanditiis.,Labore dolorem amet aliquid corporis dicta ab mollitia.,2021-11-30T16:58:14.681Z,2082-08-15T10:36:09.485Z,neutral
Dr. Cornelius Tremblay,Placeat voluptates qui ab vitae nam laboriosam labore ullam architecto. Minima incidunt reiciendis itaque eveniet ratione reiciendis. Quo perspiciatis corrupti quisquam illum illum hic blanditiis numquam. Tempore eius doloribus ducimus eos sed iusto sit. Aliquid laborum dolores.,Accusantium eaque ratione voluptatum provident sint.,2021-07-21T10:44:29.748Z,2089-11-07T12:56:21.063Z,neutral
Robin Heidenreich,Suscipit quae accusamus iste incidunt hic quisquam voluptas facere commodi. Laboriosam assumenda quia necessitatibus velit occaecati facilis alias error distinctio. Aliquid iure sequi sed doloremque quia soluta. Deleniti rerum officiis a repellat numquam fugiat facilis reprehenderit a.,Magnam ipsa nulla autem laudantium.,2021-11-10T10:08:16.008Z,2053-01-12T07:26:37.153Z,neutral
Eleanor O'Connell,Numquam odit asperiores laboriosam velit laborum voluptatibus laudantium. Incidunt neque tempore facilis dignissimos quis eligendi fugit ipsum. Est labore provident itaque nisi cum quod neque.,Omnis suscipit minus reiciendis voluptate qui dolores dolore.,2019-04-25T21:39:29.536Z,2081-07-11T11:52:01.345Z,negative
Marcus Hirthe,Unde sed at. Expedita enim porro maxime ab maiores. Veniam occaecati inventore. Eius molestiae consequuntur itaque. Dolores suscipit provident.,Delectus veritatis facere tenetur odio neque voluptatum voluptatibus corrupti.,2015-07-06T10:37:54.213Z,2034-04-27T23:07:31.506Z,neutral
Brandy Crist Sr.,Accusantium error saepe. Illum nobis at nam ullam quis. Reprehenderit inventore exercitationem ratione sint voluptatibus adipisci. Similique provident inventore molestiae facere explicabo quas magni.,Eveniet et molestias cum.,2020-05-07T12:07:55.376Z,2064-12-22T08:23:36.935Z,positive
Ruben Fay,Reiciendis ipsa ipsa eos nihil. Consectetur sequi sed. Iusto temporibus aut molestias corporis rem alias et.,Tenetur repudiandae suscipit veniam quasi debitis.,2022-12-26T02:46:53.123Z,2013-08-25T08:50:10.109Z,neutral
Peggy Franecki,Veniam commodi nihil alias quos eligendi. Architecto ex beatae maxime placeat. Exercitationem molestiae ratione. Inventore repellendus eveniet. A eaque perferendis consectetur.,Cumque distinctio totam esse veritatis ducimus pariatur necessitatibus.,2016-09-10T09:02:35.990Z,2017-08-02T08:33:44.665Z,positive
Hannah Hand,Ab quae sint esse sed maxime qui repellendus molestias atque. Excepturi rerum occaecati sed. Vero officia unde veniam. Reiciendis rerum vitae architecto temporibus nisi.,Expedita nisi quibusdam temporibus ex tempora.,2019-01-22T17:20:20.272Z,2029-08-06T00:55:14.046Z,positive
Mrs. Vanessa Murray,Qui at iste possimus. Nemo mollitia accusamus perferendis reiciendis architecto voluptatibus tenetur velit officia. Perspiciatis laboriosam cum consectetur perferendis distinctio officia earum blanditiis dignissimos. Deserunt quidem reiciendis veniam a. Vitae in molestias numquam eos iusto dolores nisi.,Qui fuga ratione repellat id aliquid nam adipisci nulla quidem.,2017-12-01T21:44:02.164Z,2067-01-09T21:52:11.886Z,neutral
Gwen Powlowski,Tempore tempora temporibus. Consequatur id ex repellendus corporis aspernatur accusamus veritatis. Optio iste ducimus earum illum reprehenderit. Tenetur praesentium perferendis ex minima odit. Rem veritatis iure quidem error maxime.,Similique recusandae neque voluptatem esse iusto maxime.,2020-02-02T19:19:30.367Z,2067-12-12T04:05:09.437Z,negative
Wade Kertzmann,Velit consequatur omnis ipsam rem dolorum. Provident consequuntur sed distinctio vel voluptatum vel. Numquam earum nobis est mollitia. Assumenda facere tempore quidem ad velit ab asperiores iusto nihil.,Aut et voluptate eveniet et mollitia dignissimos.,2013-07-03T18:21:00.838Z,2082-11-01T12:09:31.040Z,positive
Gordon Oberbrunner,Harum magni quia totam libero. Ipsam fuga atque voluptatibus cum occaecati adipisci assumenda. Voluptatum illo nulla non ullam iusto maxime fuga. Veniam rem minima.,Vel perspiciatis provident quod veniam soluta.,2017-10-26T13:52:59.336Z,2082-10-18T01:37:42.155Z,neutral
Hope Lehner,Reprehenderit adipisci cupiditate voluptates ea sed voluptatibus maxime minus accusamus. Tempora fugit veritatis cum nemo quae. Ipsa odio culpa porro maiores iusto consectetur animi similique placeat. Voluptatum numquam culpa iste sint molestias sunt ea magnam. Distinctio a maxime suscipit molestias amet.,Ducimus modi numquam ratione distinctio.,2017-06-23T18:36:28.094Z,2065-02-17T07:39:12.825Z,positive
Clarence Purdy DDS,Ipsum labore et omnis eveniet impedit. Sunt quo quibusdam ea quo recusandae ea. Quis doloribus deserunt quam vitae. Culpa recusandae mollitia sint nihil maxime possimus. Odit dolor recusandae eligendi a nam ab repudiandae aliquam. Unde ab consequuntur aliquam assumenda velit.,Repellendus suscipit quos.,2013-07-27T00:18:44.018Z,2082-11-25T06:15:11.957Z,negative
Jenny McLaughlin II,Hic distinctio quos dolorem repudiandae eligendi cumque. Animi consequuntur sint ullam est libero eaque cum. Rem omnis assumenda mollitia placeat incidunt dolorem consequatur. Molestiae ducimus tenetur.,Omnis ea praesentium quisquam.,2015-12-08T23:08:32.978Z,2083-10-12T13:16:02.073Z,negative
Hannah King,Maiores veniam ipsum. Ut fugiat laudantium sequi sint hic sit. Eos rem consectetur veritatis culpa at. Commodi asperiores est rerum quae atque quia deleniti amet.,Voluptates atque maiores magnam hic perspiciatis quas reiciendis.,2022-09-11T16:46:08.864Z,2064-09-03T03:54:09.989Z,positive
Kathy Volkman,Rerum delectus minima. Repellat porro dolores beatae excepturi corporis eius accusantium sed. Distinctio repellendus provident provident inventore voluptas.,Ab reiciendis porro facere.,2021-01-30T18:04:01.910Z,2047-01-15T02:41:26.291Z,neutral
Camille Hyatt,At voluptate laboriosam non beatae adipisci. Rerum aperiam voluptate necessitatibus. Pariatur eveniet at.,Esse voluptate ut.,2017-09-13T04:02:39.478Z,2073-10-16T00:23:07.313Z,positive
Jimmie Ward,Quae nam dicta et aliquid. Magnam veniam modi cumque. Vel quas voluptates nihil modi. Harum ab aut eius perferendis accusamus nam qui.,Cumque maxime cum.,2017-02-26T19:32:03.269Z,2050-11-15T17:17:47.872Z,positive
Alison Pfannerstill,Eum illo enim totam aperiam cum suscipit numquam aspernatur. Provident tempora ipsa et dolor. Dolorem nobis minima perferendis aspernatur voluptates doloribus perferendis. Autem ducimus et ea dicta suscipit maiores. Animi amet iure deleniti sit id dolor.,Libero molestias cumque libero esse.,2020-01-27T23:04:32.376Z,2042-06-19T14:09:30.353Z,positive
Pauline Bartoletti MD,Corporis placeat placeat. Saepe dignissimos sapiente dolorem pariatur quisquam numquam debitis occaecati nihil. Animi cum nisi quod quasi fugiat beatae. Adipisci facere cupiditate. Exercitationem est quo. Tempore dolor eos quod quam minus doloribus.,Sequi nobis aliquam eaque possimus quisquam exercitationem.,2019-04-21T13:54:14.827Z,2070-07-29T00:56:56.907Z,negative
Christie Kshlerin,Ratione eos maxime quidem aliquid magnam sequi repudiandae veniam. Labore neque molestias incidunt quod nisi magni neque. Harum quaerat reiciendis.,Consequuntur suscipit odio nostrum est odit molestias pariatur.,2019-11-17T04:40:42.047Z,2067-11-08T04:05:10.184Z,positive
Kimberly Emmerich,Debitis assumenda asperiores atque eveniet incidunt maxime. Cumque qui praesentium placeat maxime expedita deserunt deleniti. Esse numquam voluptatibus similique. Porro eius deserunt voluptate maxime maiores alias corporis ducimus maxime. Perferendis amet ea inventore.,Enim sunt corporis quisquam earum omnis.,2013-11-18T19:20:49.702Z,2055-09-08T14:17:31.728Z,neutral
Julio Koss,Recusandae libero at dolorem hic quae accusamus neque tenetur. Neque ipsa sunt suscipit quam fuga. Harum architecto ab aliquid velit.,Eos veniam consectetur et non facilis.,2019-04-03T02:47:37.455Z,2078-07-14T10:20:09.507Z,negative
Kenny Funk PhD,Eveniet ab neque eveniet dolor. Animi unde sint dolorem. Voluptates nemo porro. Reiciendis exercitationem deleniti iusto vel occaecati quibusdam. Aperiam nulla quibusdam aliquid illum minima.,Id eveniet rem dicta.,2017-11-21T13:31:18.408Z,2067-08-12T00:11:36.194Z,negative
Roger Tremblay,Nisi accusantium aperiam illum. Delectus aperiam cum magni. Possimus expedita quae voluptatem hic accusamus iste. Asperiores reiciendis voluptatum quam tempora. Consectetur sapiente modi sunt veniam quasi numquam sequi esse ullam. Temporibus quasi aut dolor totam unde repudiandae adipisci ipsam.,Consectetur libero ducimus ab quia corporis.,2022-11-11T14:51:50.065Z,2034-11-24T22:56:48.515Z,positive
Shelly Johnson,A placeat quidem libero tempore vero fugiat ullam. Modi ducimus consequatur accusantium nam esse doloremque temporibus expedita. Possimus fuga fuga quas accusantium enim numquam cumque illo aspernatur. Aperiam amet soluta laboriosam ducimus dicta autem cum tempora.,Consequuntur tempora eius accusantium blanditiis aspernatur id.,2017-10-30T16:58:42.646Z,2064-02-17T13:12:42.825Z,negative
Miss Elsie Walsh,Aspernatur rerum ipsa repudiandae accusamus tenetur a in velit. Ducimus illo possimus magni perspiciatis. Reprehenderit eveniet voluptatum ducimus.,Iure laboriosam saepe hic commodi ipsa quae in.,2020-10-31T10:47:01.228Z,2009-10-01T09:45:06.240Z,positive
Julian Hartmann,Soluta sed assumenda aut dolor totam assumenda autem maiores iusto. Aut recusandae vel doloribus. Aut possimus voluptas magnam beatae in blanditiis sunt reprehenderit. Fugiat deserunt est.,Amet animi ipsam cumque tempore eum qui sequi dolore.,2019-06-11T11:34:19.066Z,2077-03-02T00:40:13.288Z,negative
Darren Legros,Possimus cupiditate voluptas vero doloremque deleniti. Dolore officia nulla animi placeat optio tempora quia libero. Occaecati eligendi esse quae soluta.,Odit velit minima fugiat culpa officia.,2017-05-06T14:00:39.235Z,2082-07-22T01:00:55.500Z,positive
Eduardo Pfannerstill,Eveniet itaque possimus. Provident quod eaque optio veritatis reiciendis. Eos ullam repudiandae sequi voluptatem consequuntur. Aut id enim harum autem.,Dolores qui fugit alias dolores.,2020-09-22T23:47:20.872Z,2055-05-14T07:22:40.830Z,neutral
Jared Hermann,Quisquam vitae dolor perferendis praesentium ducimus esse. Recusandae tenetur deserunt. Enim architecto magnam itaque reiciendis. Nisi reiciendis optio omnis maxime. Fugiat aliquid doloribus molestiae libero nulla.,Eos provident tenetur voluptatibus inventore incidunt quis mollitia repellat quasi.,2019-04-28T14:01:44.076Z,2096-07-03T20:02:14.704Z,positive
Heidi Schulist,Facilis totam laborum nisi voluptate alias voluptate. Fuga quam consequuntur eligendi. Veritatis sunt optio voluptatibus debitis sunt neque dicta. Necessitatibus assumenda iusto est itaque eveniet culpa.,Molestias consectetur nulla harum.,2015-10-08T00:06:40.773Z,2095-06-24T23:05:09.821Z,neutral
Ms. Cassandra Weissnat MD,Hic vero dolor molestiae aut sint atque. Ducimus expedita aliquam corporis perferendis soluta perspiciatis fugit voluptatum nam. Iure saepe dolores totam dignissimos corrupti beatae eligendi repellendus. Molestias nisi quae officiis. Harum assumenda vitae ea architecto soluta cum.,Rem architecto natus placeat exercitationem.,2014-10-21T11:41:13.702Z,2014-08-31T16:14:48.968Z,negative
Gloria Ferry,Vitae consectetur id quos eius asperiores nesciunt repellat atque perferendis. Exercitationem harum iusto quis cumque aspernatur. Sit maxime excepturi. Expedita amet non molestias odit ut. Repellat fugit qui inventore saepe nostrum repellat provident adipisci ducimus.,Assumenda reiciendis voluptates dignissimos quas saepe accusantium id laboriosam est.,2013-06-07T06:46:36.640Z,2049-02-28T19:49:52.327Z,neutral
Lorena Hahn IV,Consectetur explicabo maiores tenetur. Debitis voluptatibus nemo expedita adipisci omnis explicabo eos. Quisquam molestiae libero cumque dolore ipsa. Consequuntur aspernatur perspiciatis eius.,Vero tempora illo officiis sed sequi velit adipisci vitae reiciendis.,2016-12-02T02:11:04.340Z,2085-11-04T03:28:53.877Z,neutral
Timothy Cassin,Autem veritatis non commodi odio dolore maiores id. Nihil illo fuga architecto recusandae. Atque cumque quibusdam autem dicta nobis asperiores. Doloribus labore et architecto doloribus quaerat velit necessitatibus maiores. Corrupti aperiam nihil neque beatae consectetur accusantium.,Aperiam harum doloribus vero iste.,2020-03-13T17:50:19.207Z,2032-08-28T21:05:59.645Z,positive
Samuel Prohaska,Ipsa voluptas tempore magni. Quam quo nobis. Harum error voluptatem quos eius explicabo unde officia.,Quasi molestiae debitis similique atque eius corrupti porro dolorem alias.,2018-01-15T06:41:18.275Z,2060-04-03T23:45:06.438Z,neutral
Cornelius Dicki Sr.,Suscipit ab nam. In deserunt recusandae voluptas repudiandae non temporibus temporibus. Quas eius est occaecati. Fuga id ipsum eveniet dolorum.,Iure neque officiis perspiciatis modi sequi quam tempora.,2022-07-22T08:27:09.561Z,2042-10-31T22:08:48.226Z,neutral
Claudia Bernier,Dolor quis ea esse aperiam. Nobis officia animi animi dolore. Maxime sequi cum delectus provident quod deserunt soluta. Excepturi neque animi iste distinctio laboriosam velit. Labore omnis at repellat ex. Qui repellat corporis deserunt earum fuga doloribus.,Necessitatibus facere atque doloremque in veniam illum illo est dicta.,2021-01-17T17:08:13.999Z,2062-12-16T01:52:26.730Z,positive
Mrs. Dan Russel III,Temporibus praesentium voluptatibus facere. Rem beatae sunt unde. Nulla officia laborum animi nisi quibusdam delectus. Doloribus repellendus deserunt deserunt quaerat.,Modi provident hic atque ipsa.,2017-08-30T13:07:38.654Z,2049-03-08T18:13:14.005Z,negative
Bryant Schamberger,Unde animi nesciunt quidem harum reprehenderit. Dolorum est neque voluptas magnam ipsum autem. Itaque quae voluptatem. Commodi magnam odit.,Commodi minus minima molestiae laboriosam quidem neque.,2015-03-13T01:37:17.263Z,2099-04-06T18:56:10.491Z,positive
Susan Kohler,Ratione sunt eius iste. Porro fugiat iure corrupti dicta asperiores modi nesciunt. Pariatur esse exercitationem delectus perferendis doloremque voluptate. Libero distinctio maxime a impedit aliquid odit.,Magnam aspernatur exercitationem.,2017-08-06T08:20:46.913Z,2036-01-12T14:50:12.287Z,neutral
Jean Feeney II,Dolorem maiores officiis. Doloremque laborum voluptatem quia illo aliquam ab animi. Vero odit maxime nostrum earum mollitia cupiditate pariatur veritatis velit. Eos ipsa dicta laudantium perspiciatis praesentium ad vitae sapiente.,Ullam deserunt et facere doloremque incidunt officia asperiores.,2021-11-01T09:01:23.933Z,2026-09-10T04:45:50.562Z,positive
Alfredo Block II,Non unde dolores adipisci voluptate iusto recusandae. Hic numquam necessitatibus. Ipsum aut quasi.,Asperiores quam dolores nisi est sed itaque asperiores.,2020-01-07T05:53:49.815Z,1991-06-10T12:17:33.429Z,neutral
Ginger Fay,Porro quasi dolore quis illo. Voluptates quaerat esse iure in sapiente illum nemo eligendi. Inventore consequatur voluptatibus ducimus alias quasi. Fugit nihil incidunt illo omnis beatae dignissimos qui. Aut sed impedit libero accusamus dolores illum incidunt voluptas.,Voluptate repellat quis nam odit optio amet esse unde.,2015-11-04T05:09:22.566Z,2000-08-29T05:17:35.611Z,positive
Joseph Bergstrom,Culpa quae sit sint vitae neque nostrum est. Quod sunt libero eos modi. Eligendi ipsum eius ut nam eaque ab. Modi laborum consectetur eaque aut temporibus nobis beatae velit. Vel autem sint beatae expedita sed facere. Vitae odio quis vero minus error nesciunt occaecati excepturi harum.,Ipsa officiis et earum autem.,2021-08-08T00:39:59.730Z,2033-04-15T21:35:29.402Z,negative
